MCQ,Choices,Correct
Who first coined the term 'machine learning'?,a: Alan Turing | b: Donald Hebb | c: Arthur Samuel | d: Tom M. Mitchell,c
Donald Hebb's work on interacting neurons laid the groundwork for what aspect of modern AI?,a: Computer vision | b: Natural language processing | c: Artificial neural networks | d: Reinforcement learning,c
What was the primary function of the early 'learning machine' Cybertron?,a: Playing checkers | b: Predicting stock prices | c: Recognizing patterns in data | d: Translating languages,c
Tom M. Mitchell's definition of machine learning emphasizes which key concept?,a: Human-like thought processes | b: Improved performance with experience | c: The ability to pass the Turing test | d: The use of specific programming languages,b
What are the two main objectives of modern machine learning?,a: Data classification and prediction | b: Image recognition and speech synthesis | c: Playing games and solving equations | d: Robot control and autonomous navigation,a
